status;atlas_ref_id;brot_id;rezept_variante;name;gruppe;schritt_nr;zutaten_list;anweisung;techniken_tags;zeit_aufwand;bild_ref;quelle;bild_lead;step_bild_positive_prompt;step_bild_negativ_prompt;lead_bild_positive_prompt;lead_bild_negativ_prompt;tipps;gemini_comment1;gemini_comment2;Herkunft;Geschichte, Entstehung;Tradition;
active;CH-ZOPF-002;CHE-00045-G-001;1;UrDinkel-Vollkorn-Brot;Spezialbrote;3;UrDinkelmehl;Formen & Backen: Kleine Stücke (ca 300g) formen. Je zwei mit Schluss nach oben in gefettete Form. Bemehlen. 5 Min ruhen. Bei 230 Grad ca. 30 Min backen.;Formen,Backen;40 Min;CHE-00045-G-001-st3.jpg;Schweizer Brot;CHE-00045-G-001.jpg;Professional food photography, placing dough pieces into bread tins, flour dusting;blurry, text, cartoon;Professional food photography, UrDinkel-Vollkorn-Brot, spelt whole grain bread in tin, dark crust, dense crumb;blurry, text, cartoon;Kastenform stützt den Teig.;Schluss oben gibt rustikalen Riss.;Kürzer, dafür heiss backen.;Schweiz (Alpenraum);Dinkel (Spelt) war vor dem Weizen das Hauptgetreide der Alemannen.;UrDinkel bezeichnet reine, nicht mit Weizen gekreuzte Sorten. Das Brot ist sehr aromatisch und nussig.;
active;CH-SPEC-017;CHE-00046-G-001;1;Olivenbrot;Spezialbrote;1;1kg Weissmehl, 7.2dl Wasser, 30g Hefe, 50g Olivenöl, 20g Salz, 300g Oliven (geschnitten), 5g Oregano;Teig: Mehl/Wasser/Hefe mischen. Öl dazu. Salz dazu, kneten. Oliven/Oregano untermischen. Ruhen bis doppelt gross.;Kneten,Gären;90 Min;CHE-00046-G-001-st1.jpg;Schweizer Brot;CHE-00046-G-001.jpg;Professional food photography, dough with sliced olives and herbs mixed in;blurry, text, cartoon;Professional food photography, Olivenbrot (Olive Bread), twisted rustic loaf, shiny olive oil crust, herbs visible;blurry, text, cartoon;Oliven gut abtropfen (sonst wird Teig lila/nass).;Oregano für den Pizzageschmack.;Gutes Olivenöl verwenden.;Mittelmeerraum;Kam mit der italienischen Einwanderung und dem Tourismus in die Schweiz.;Beliebtes Apéro- und Grillbrot. Oft als Wurzelbrot oder 'Pain Paillasse' geformt.;
active;CH-SPEC-017;CHE-00046-G-001;1;Olivenbrot;Spezialbrote;2;Olivenöl, Mandeln (optional);Formen: Zwei Teigstücke rund/länglich formen, leicht drehen (Torsion). Mit Öl bestreichen, evtl. Mandeln bestreuen. Ruhen.;Formen,Drehen,Glasieren;20 Min;CHE-00046-G-001-st2.jpg;Schweizer Brot;CHE-00046-G-001.jpg;Professional food photography, twisting dough loaf, brushing with olive oil;blurry, text, cartoon;Professional food photography, Olivenbrot (Olive Bread), twisted rustic loaf, shiny olive oil crust, herbs visible;blurry, text, cartoon;Drehen schafft rustikale Optik.;Nicht zu fest drücken.;Öl sorgt für Knusprigkeit.;Mittelmeerraum;Kam mit der italienischen Einwanderung und dem Tourismus in die Schweiz.;Beliebtes Apéro- und Grillbrot. Oft als Wurzelbrot oder 'Pain Paillasse' geformt.;
active;CH-SPEC-017;CHE-00046-G-001;1;Olivenbrot;Spezialbrote;3;Keine;Backen: Bei 200 Grad 50-60 Min knusprig backen.;Backen;60 Min;CHE-00046-G-001-st3.jpg;Schweizer Brot;CHE-00046-G-001.jpg;Professional food photography, olive bread baking, golden crust;blurry, text, cartoon;Professional food photography, Olivenbrot (Olive Bread), twisted rustic loaf, shiny olive oil crust, herbs visible;blurry, text, cartoon;Darf dunkel werden.;Duftet nach Italien.;Frisch verzehren.;Mittelmeerraum;Kam mit der italienischen Einwanderung und dem Tourismus in die Schweiz.;Beliebtes Apéro- und Grillbrot. Oft als Wurzelbrot oder 'Pain Paillasse' geformt.;
active;CH-SPEC-018;CHE-00047-G-001;1;Knusperbrot mit Joghurt;Spezialbrote;1;720g Halbweissmehl, 280g Vollkornmehl, 2.4dl Milch, 2.4dl Wasser, 270g Nature-Joghurt, 30g Hefe, 50g Butter, 25g Salz;Teig: Mehle, Milch, Wasser, Joghurt, Hefe mischen. Butter dazu. Salz dazu, gut kneten. Ruhen bis doppelt gross.;Kneten,Gären;90 Min;CHE-00047-G-001-st1.jpg;Schweizer Brot;CHE-00047-G-001.jpg;Professional food photography, mixing dough with yogurt and milk, creamy texture;blurry, text, cartoon;Professional food photography, Knusperbrot mit Joghurt, round or oval rustic loaf with flat cut, very fluffy crumb, crispy crust;blurry, text, cartoon;Joghurt macht Teig säuerlich-frisch.;Milchsäure verbessert Klebergerüst.;Sehr fluffige Krume.;Modern;Joghurt als Zutat verlängert die Frischhaltung und gibt einen mild-säuerlichen Geschmack.;Oft als gesundes Frühstücksbrot vermarktet.;
active;CH-SPEC-018;CHE-00047-G-001;1;Knusperbrot mit Joghurt;Spezialbrote;2;Halbweissmehl;Formen: Zwei Teigstücke rund, dann länglich formen. Kurz gehen lassen. Bemehlen. Flach einschneiden.;Formen,Einschneiden;20 Min;CHE-00047-G-001-st2.jpg;Schweizer Brot;CHE-00047-G-001.jpg;Professional food photography, scoring dough loaf with a flat blade, flour on top;blurry, text, cartoon;Professional food photography, Knusperbrot mit Joghurt, round or oval rustic loaf with flat cut, very fluffy crumb, crispy crust;blurry, text, cartoon;Flacher Schnitt gibt breiten Ausbund.;Mehlstaub für Optik.;Teig ist elastisch.;Modern;Joghurt als Zutat verlängert die Frischhaltung und gibt einen mild-säuerlichen Geschmack.;Oft als gesundes Frühstücksbrot vermarktet.;
active;CH-SPEC-018;CHE-00047-G-001;1;Knusperbrot mit Joghurt;Spezialbrote;3;Keine;Backen: Bei 220 Grad 50-60 Min knusprig backen.;Backen;60 Min;CHE-00047-G-001-st3.jpg;Schweizer Brot;CHE-00047-G-001.jpg;Professional food photography, yogurt bread in oven, steam, crust formation;blurry, text, cartoon;Professional food photography, Knusperbrot mit Joghurt, round or oval rustic loaf with flat cut, very fluffy crumb, crispy crust;blurry, text, cartoon;Wird schön goldbraun.;Kruste splittert leicht.;Mildes Aroma.;Modern;Joghurt als Zutat verlängert die Frischhaltung und gibt einen mild-säuerlichen Geschmack.;Oft als gesundes Frühstücksbrot vermarktet.;
active;CH-BASIC-003;CHE-00048-G-001;1;Halbweissbrot;Grundteige;1;1kg Halbweissmehl, 7dl Wasser, 20g Hefe, 20g Salz;Mischen & Kneten: Mehl und Hefe mit Wasser mischen. Salz nach 5 Min. 10 Min kneten.;Kneten;15 Min;CHE-00048-G-001-st1.jpg;Schweizer Brot;CHE-00048-G-001.jpg;Professional food photography, mixing semi-white flour dough, smooth texture;blurry, text, cartoon;Professional food photography, Halbweissbrot (Semi-white bread), classic swiss oval loaf, golden crust, 2-3 diagonal cuts, sliced;blurry, text, cartoon;Standardmehl der Schweizer Bäcker.;Etwas mehr Schale als Weissmehl, aber hell.;Universalteig.;Schweiz (Basis);Das 'Schweizer Brot' schlechthin neben dem Ruchbrot.;Halbweissmehl ist eine Schweizer Spezialität (Type 720/700), die den Kompromiss zwischen hellem Aussehen und Geschmack bildet.;
active;CH-BASIC-003;CHE-00048-G-001;1;Halbweissbrot;Grundteige;2;Keine;Gären: 60 Min ruhen lassen. Nach 30 Min einmal zusammenschlagen (entgasen).;Gären,Falten;60 Min;CHE-00048-G-001-st2.jpg;Schweizer Brot;CHE-00048-G-001.jpg;Professional food photography, punching down risen dough, releasing gas;blurry, text, cartoon;Professional food photography, Halbweissbrot (Semi-white bread), classic swiss oval loaf, golden crust, 2-3 diagonal cuts, sliced;blurry, text, cartoon;Zusammenschlagen verfeinert die Porung.;Gleichmässige Gare.;Standardführung.;Schweiz (Basis);Das 'Schweizer Brot' schlechthin neben dem Ruchbrot.;Halbweissmehl ist eine Schweizer Spezialität (Type 720/700), die den Kompromiss zwischen hellem Aussehen und Geschmack bildet.;
active;CH-BASIC-003;CHE-00048-G-001;1;Halbweissbrot;Grundteige;3;Keine;Formen: Zu einem runden oder langen Laib formen. Auf Blech nochmals 30 Min gehen lassen.;Formen;35 Min;CHE-00048-G-001-st3.jpg;Schweizer Brot;CHE-00048-G-001.jpg;Professional food photography, shaping simple bread loaf on table;blurry, text, cartoon;Professional food photography, Halbweissbrot (Semi-white bread), classic swiss oval loaf, golden crust, 2-3 diagonal cuts, sliced;blurry, text, cartoon;Schluss gut verschliessen.;Form ist variabel (Pfünderli).;Glatte Oberfläche anstreben.;Schweiz (Basis);Das 'Schweizer Brot' schlechthin neben dem Ruchbrot.;Halbweissmehl ist eine Schweizer Spezialität (Type 720/700), die den Kompromiss zwischen hellem Aussehen und Geschmack bildet.;
active;CH-BASIC-003;CHE-00048-G-001;1;Halbweissbrot;Grundteige;4;Wasser;Backen: Einschneiden, mit Wasser bepinseln. Bei 230 Grad ca. 50-60 Min backen. Auf Rost auskühlen.;Backen,Einschneiden;60 Min;CHE-00048-G-001-st4.jpg;Schweizer Brot;CHE-00048-G-001.jpg;Professional food photography, bread cooling on wire rack, steam rising;blurry, text, cartoon;Professional food photography, Halbweissbrot (Semi-white bread), classic swiss oval loaf, golden crust, 2-3 diagonal cuts, sliced;blurry, text, cartoon;Längsschnitt oder Querschnitte.;Wasserglanz ist typisch.;Der Allrounder.;Schweiz (Basis);Das 'Schweizer Brot' schlechthin neben dem Ruchbrot.;Halbweissmehl ist eine Schweizer Spezialität (Type 720/700), die den Kompromiss zwischen hellem Aussehen und Geschmack bildet.;
active;CH-SPEC-019;CHE-00049-G-001;1;Hirsebrot;Spezialbrote;1;260g Hirse (ganz), 1.4dl Wasser (kochend);Brühstück: Hirse mit kochendem Wasser übergiessen. Quellen und abkühlen lassen (Vortag/Kühlschrank).;Brühen,Kühlen;120 Min;CHE-00049-G-001-st1.jpg;Schweizer Brot;CHE-00049-G-001.jpg;Professional food photography, millet grains in bowl with hot water, steam;blurry, text, cartoon;Professional food photography, Hirsebrot (Millet Bread), rustic loaf with millet topping, golden yellow crumb, texture visible;blurry, text, cartoon;Hirse muss weich werden (Brühstück).;Glutenfreies Korn in Weizenteig.;Gibt schönen Biss.;Antike / Revival;Hirse war vor Einführung der Kartoffel ein Grundnahrungsmittel in Europa.;Heute als Spezialbrot wiederentdeckt, reich an Mineralstoffen (Silizium).;
active;CH-SPEC-019;CHE-00049-G-001;1;Hirsebrot;Spezialbrote;2;Brühstück, 1kg Weizenmehl, 7dl Wasser, 30g Hefe, 20g Salz, Haferflocken (Deko);Teig: Mehl, Wasser, Hefe, Salz und Brühstück mischen. Kneten. 75-90 Min ruhen lassen.;Kneten,Gären;90 Min;CHE-00049-G-001-st2.jpg;Schweizer Brot;CHE-00049-G-001.jpg;Professional food photography, dough with millet grains visible mixed in;blurry, text, cartoon;Professional food photography, Hirsebrot (Millet Bread), rustic loaf with millet topping, golden yellow crumb, texture visible;blurry, text, cartoon;Hirse bindet kein Gluten, Weizen stützt.;Teigstruktur ist körnig.;Gut kneten.;Antike / Revival;Hirse war vor Einführung der Kartoffel ein Grundnahrungsmittel in Europa.;Heute als Spezialbrot wiederentdeckt, reich an Mineralstoffen (Silizium).;
active;CH-SPEC-019;CHE-00049-G-001;1;Hirsebrot;Spezialbrote;3;1 Ei;Formen: 2 grosse, 2 kleine Stücke formen. Grosse Stücke eindrücken, kleine hineinsetzen (Ei als Kleber). In Hirse/Flocken wälzen. Ruhen.;Formen,Zusammensetzen;20 Min;CHE-00049-G-001-st3.jpg;Schweizer Brot;CHE-00049-G-001.jpg;Professional food photography, assembling two dough parts, brushing with egg;blurry, text, cartoon;Professional food photography, Hirsebrot (Millet Bread), rustic loaf with millet topping, golden yellow crumb, texture visible;blurry, text, cartoon;Zusammengesetzte Form ('Hut') ist dekorativ.;Körner aussen geben Knusper.;Ei klebt die Teile.;Antike / Revival;Hirse war vor Einführung der Kartoffel ein Grundnahrungsmittel in Europa.;Heute als Spezialbrot wiederentdeckt, reich an Mineralstoffen (Silizium).;
active;CH-SPEC-019;CHE-00049-G-001;1;Hirsebrot;Spezialbrote;4;Keine;Backen: Bei 230 Grad ca. 50 Min backen.;Backen;50 Min;CHE-00049-G-001-st4.jpg;Schweizer Brot;CHE-00049-G-001.jpg;Professional food photography, millet bread in oven, baking;blurry, text, cartoon;Professional food photography, Hirsebrot (Millet Bread), rustic loaf with millet topping, golden yellow crumb, texture visible;blurry, text, cartoon;Goldgelbe Krume (durch Hirse).;Kruste bräunt schön.;Gesunde Abwechslung.;Antike / Revival;Hirse war vor Einführung der Kartoffel ein Grundnahrungsmittel in Europa.;Heute als Spezialbrot wiederentdeckt, reich an Mineralstoffen (Silizium).;
active;CH-SPEC-020;CHE-00050-G-001;1;Burebrot;Spezialbrote;1;750g Weissmehl, 250g Roggenmehl, 4dl Milch, 1dl Wasser, 10g Hefe, 20g Salz;Mischen & Kneten: Mehle, Flüssigkeit, Hefe mischen. Salz nach 5 Min. 10 Min kneten. Ruhen bis doppelt gross.;Kneten,Gären;90 Min;CHE-00050-G-001-st1.jpg;Schweizer Brot;CHE-00050-G-001.jpg;Professional food photography, mixing rye and wheat flour dough with milk;blurry, text, cartoon;Professional food photography, Burebrot (Swiss Farmer Bread), round rustic loaf with diamond pattern flour dusting, dark crust;blurry, text, cartoon;Milch macht die Krume fein und weich.;Roggenanteil für den Geschmack.;Sehr beliebtes Alltagsbrot.;Schweiz (Tradition);Der Name 'Burebrot' (Bauernbrot) suggeriert ländliche Tradition, ist aber oft ein definiertes Markenprodukt (IP-Suisse).;Typisch ist der Mix aus Weizen und Roggen sowie Milch im Teig, was es vom Ruchbrot unterscheidet.;
active;CH-SPEC-020;CHE-00050-G-001;1;Burebrot;Spezialbrote;2;Mehl;Formen: Zwei Teigstücke rund formen. Umdrehen, auf Blech. Kurz gehen lassen. Mit Klinge rautenförmig einschneiden.;Formen,Einschneiden;25 Min;CHE-00050-G-001-st2.jpg;Schweizer Brot;CHE-00050-G-001.jpg;Professional food photography, scoring diamond pattern into round dough loaf;blurry, text, cartoon;Professional food photography, Burebrot (Swiss Farmer Bread), round rustic loaf with diamond pattern flour dusting, dark crust;blurry, text, cartoon;Rautenmuster (Karos) ist das Markenzeichen.;Vorher gut bemehlen.;Rund und rustikal.;Schweiz (Tradition);Der Name 'Burebrot' (Bauernbrot) suggeriert ländliche Tradition, ist aber oft ein definiertes Markenprodukt (IP-Suisse).;Typisch ist der Mix aus Weizen und Roggen sowie Milch im Teig, was es vom Ruchbrot unterscheidet.;
active;CH-SPEC-020;CHE-00050-G-001;1;Burebrot;Spezialbrote;3;Keine;Backen: Bei 230 Grad 40-50 Min backen.;Backen;50 Min;CHE-00050-G-001-st3.jpg;Schweizer Brot;CHE-00050-G-001.jpg;Professional food photography, farmer bread baking, crust forming;blurry, text, cartoon;Professional food photography, Burebrot (Swiss Farmer Bread), round rustic loaf with diamond pattern flour dusting, dark crust;blurry, text, cartoon;Kruste soll mehlig-rustikal wirken.;Nicht zu dunkel backen (Milchzucker bräunt schnell).;Weiche Kruste.;Schweiz (Tradition);Der Name 'Burebrot' (Bauernbrot) suggeriert ländliche Tradition, ist aber oft ein definiertes Markenprodukt (IP-Suisse).;Typisch ist der Mix aus Weizen und Roggen sowie Milch im Teig, was es vom Ruchbrot unterscheidet.;
active;CH-SPEC-021;CHE-00051-G-001;1;Gemüsebrot;Spezialbrote;1;800g Weizenmehl, 200g Weizenschrot, 6.5dl Wasser, 35g Hefe, 30g Salz, 115g Gemüsemischung (getrocknet), 85g Olivenöl;Mischen & Kneten: Mehle, Wasser, Hefe mischen. Öl dazu. Salz dazu. Gemüse am Schluss unterkneten. 75-90 Min ruhen.;Kneten,Gären;100 Min;CHE-00051-G-001-st1.jpg;Schweizer Brot;CHE-00051-G-001.jpg;Professional food photography, dough with dried vegetable flakes visible, kneading;blurry, text, cartoon;Professional food photography, Gemüsebrot, rustic rectangular loaf, vegetable pieces visible in crumb, healthy look;blurry, text, cartoon;Trockengemüse evtl. kurz einweichen oder Wasser anpassen.;Schrot für Biss.;Farbenfroh.;Modern;Trend zu gesunden, angereicherten Broten.;Oft mit Karotten, Lauch oder Sellerie. Schmeckt hervorragend nur mit Butter.;
active;CH-SPEC-021;CHE-00051-G-001;1;Gemüsebrot;Spezialbrote;2;Keine;Formen: Zwei Stücke rund, dann zu Rechtecken formen. Bemehlen. Auf Blech 30 Min ruhen.;Formen;35 Min;CHE-00051-G-001-st2.jpg;Schweizer Brot;CHE-00051-G-001.jpg;Professional food photography, shaping rectangular bread loaves, flour dusting;blurry, text, cartoon;Professional food photography, Gemüsebrot, rustic rectangular loaf, vegetable pieces visible in crumb, healthy look;blurry, text, cartoon;Kastenform auch möglich.;Rustikale Oberfläche.;Gemüsestücke sollen sichtbar sein.;Modern;Trend zu gesunden, angereicherten Broten.;Oft mit Karotten, Lauch oder Sellerie. Schmeckt hervorragend nur mit Butter.;
active;CH-SPEC-021;CHE-00051-G-001;1;Gemüsebrot;Spezialbrote;3;Keine;Backen: Bei 230 Grad 50-60 Min backen.;Backen;60 Min;CHE-00051-G-001-st3.jpg;Schweizer Brot;CHE-00051-G-001.jpg;Professional food photography, vegetable bread baking in oven;blurry, text, cartoon;Professional food photography, Gemüsebrot, rustic rectangular loaf, vegetable pieces visible in crumb, healthy look;blurry, text, cartoon;Aromatisch.;Gemüse darf nicht verbrennen (Hitze anpassen).;Saftig durch Gemüseanteil.;Modern;Trend zu gesunden, angereicherten Broten.;Oft mit Karotten, Lauch oder Sellerie. Schmeckt hervorragend nur mit Butter.;
active;CH-BASIC-004;CHE-00052-G-001;1;Ruchbrot;Grundteige;1;1kg Ruchmehl, 7dl Wasser, 30g Hefe, 30g Salz;Mischen: Mehl und Wasser (30 Grad) mischen, 15 Min stehen lassen (Autolyse). Hefe/Salz dazu.;Mischen,Autolyse;20 Min;CHE-00052-G-001-st1.jpg;Schweizer Brot;CHE-00052-G-001.jpg;Professional food photography, mixing dark ruchmehl flour and water, shaggy mass;blurry, text, cartoon;Professional food photography, Ruchbrot (Swiss Dark Bread), dark brown crust, elongated loaf with diagonal cuts, rustic crumb;blurry, text, cartoon;Ruchmehl (Type 1100) enthält Teile der Schale.;Autolyse verbessert Wasseraufnahme.;Das Brot der Schweiz.;Schweiz (Basis);Der Begriff 'Ruch' bedeutete früher rau/grob. Es war das günstigere Brot im Vergleich zum Herrenbrot (Weissbrot).;Heute das beliebteste Schweizer Brot. Kräftiger Geschmack, dunkle Kruste, sehr gute Frischhaltung.;
active;CH-BASIC-004;CHE-00052-G-001;1;Ruchbrot;Grundteige;2;Keine;Kneten & Gären: Fertig kneten. 2 Stunden ruhen (nach 1h falten).;Kneten,Gären,Falten;130 Min;CHE-00052-G-001-st2.jpg;Schweizer Brot;CHE-00052-G-001.jpg;Professional food photography, folding dark dough, gluten structure;blurry, text, cartoon;Professional food photography, Ruchbrot (Swiss Dark Bread), dark brown crust, elongated loaf with diagonal cuts, rustic crumb;blurry, text, cartoon;Lange Gare für Aroma.;Teig darf weich sein.;Falten gibt Stand.;Schweiz (Basis);Der Begriff 'Ruch' bedeutete früher rau/grob. Es war das günstigere Brot im Vergleich zum Herrenbrot (Weissbrot).;Heute das beliebteste Schweizer Brot. Kräftiger Geschmack, dunkle Kruste, sehr gute Frischhaltung.;
active;CH-BASIC-004;CHE-00052-G-001;1;Ruchbrot;Grundteige;3;Keine;Formen: Zu beliebigen Broten formen. 20 Min garen. Einschneiden.;Formen,Einschneiden;25 Min;CHE-00052-G-001-st3.jpg;Schweizer Brot;CHE-00052-G-001.jpg;Professional food photography, shaped ruchbrot loaf rising on baking sheet;blurry, text, cartoon;Professional food photography, Ruchbrot (Swiss Dark Bread), dark brown crust, elongated loaf with diagonal cuts, rustic crumb;blurry, text, cartoon;Klassisch lang oder rund.;Einschneiden ist wichtig für Ausbund.;Bemehlen.;Schweiz (Basis);Der Begriff 'Ruch' bedeutete früher rau/grob. Es war das günstigere Brot im Vergleich zum Herrenbrot (Weissbrot).;Heute das beliebteste Schweizer Brot. Kräftiger Geschmack, dunkle Kruste, sehr gute Frischhaltung.;
active;CH-BASIC-004;CHE-00052-G-001;1;Ruchbrot;Grundteige;4;Keine;Backen: Bei 230 Grad ca. 55 Min backen.;Backen;55 Min;CHE-00052-G-001-st4.jpg;Schweizer Brot;CHE-00052-G-001.jpg;Professional food photography, ruchbrot in oven, dark crust forming;blurry, text, cartoon;Professional food photography, Ruchbrot (Swiss Dark Bread), dark brown crust, elongated loaf with diagonal cuts, rustic crumb;blurry, text, cartoon;Dunkel ausbacken ('rösch').;Muss hohl klingen.;Basis für viele Kantonsbrote.;Schweiz (Basis);Der Begriff 'Ruch' bedeutete früher rau/grob. Es war das günstigere Brot im Vergleich zum Herrenbrot (Weissbrot).;Heute das beliebteste Schweizer Brot. Kräftiger Geschmack, dunkle Kruste, sehr gute Frischhaltung.;
active;CH-SPEC-022;CHE-00053-G-001;1;Bierbrot;Spezialbrote;1;1kg Weizenmehl, 50g Roggenmehl, 3.3dl Bier, 3.3dl Wasser, 20g Hefe, 450g Kartoffelstock (zubereitet), 30g Salz;Mischen & Kneten: Mehl, Bier, Wasser, Hefe, Kartoffelstock mischen. Salz dazu. 10 Min kneten. Ruhen bis doppelt gross.;Kneten,Gären;90 Min;CHE-00053-G-001-st1.jpg;Schweizer Brot;CHE-00053-G-001.jpg;Professional food photography, mixing dough with beer and mashed potatoes;blurry, text, cartoon;Professional food photography, Bierbrot (Beer Bread), rustic crusty loaf, slightly irregular shape, flour dusted, hearty crumb;blurry, text, cartoon;Zimmertemperiertes Bier verwenden.;Kartoffelstock macht es saftig.;Dunkles Bier gibt mehr Geschmack.;Mitteleuropa;Historische Verbindung von Brauerei und Bäckerei (Hefe).;Herzhaftes Brot, passt gut zu Grilladen oder Charcuterie. Die Kohlensäure im Bier lockert den Teig zusätzlich.;
active;CH-SPEC-022;CHE-00053-G-001;1;Bierbrot;Spezialbrote;2;Keine;Gären: 60 Min ruhen. Falten/Aufziehen.;Gären,Falten;65 Min;CHE-00053-G-001-st2.jpg;Schweizer Brot;CHE-00053-G-001.jpg;Professional food photography, folding dough on table, fermentation bubbles;blurry, text, cartoon;Professional food photography, Bierbrot (Beer Bread), rustic crusty loaf, slightly irregular shape, flour dusted, hearty crumb;blurry, text, cartoon;Teig ist oft weich.;Alkohol verfliegt grösstenteils.;Maltesernote.;Mitteleuropa;Historische Verbindung von Brauerei und Bäckerei (Hefe).;Herzhaftes Brot, passt gut zu Grilladen oder Charcuterie. Die Kohlensäure im Bier lockert den Teig zusätzlich.;
active;CH-SPEC-022;CHE-00053-G-001;1;Bierbrot;Spezialbrote;3;Mehl;Formen: In 3 Teile teilen, flach drücken. Enden einschlagen (dreieckig/oval). Umdrehen (Schluss unten). Bemehlen.;Formen;20 Min;CHE-00053-G-001-st3.jpg;Schweizer Brot;CHE-00053-G-001.jpg;Professional food photography, shaping rustic loaves, flour dusting;blurry, text, cartoon;Professional food photography, Bierbrot (Beer Bread), rustic crusty loaf, slightly irregular shape, flour dusted, hearty crumb;blurry, text, cartoon;Rustikale Form passt zum Thema.;Mehlige Oberfläche.;Brot für Männerabende.;Mitteleuropa;Historische Verbindung von Brauerei und Bäckerei (Hefe).;Herzhaftes Brot, passt gut zu Grilladen oder Charcuterie. Die Kohlensäure im Bier lockert den Teig zusätzlich.;
active;CH-SPEC-022;CHE-00053-G-001;1;Bierbrot;Spezialbrote;4;Keine;Backen: Bei 230 Grad 40-50 Min backen.;Backen;50 Min;CHE-00053-G-001-st4.jpg;Schweizer Brot;CHE-00053-G-001.jpg;Professional food photography, beer bread baking in stone oven;blurry, text, cartoon;Professional food photography, Bierbrot (Beer Bread), rustic crusty loaf, slightly irregular shape, flour dusted, hearty crumb;blurry, text, cartoon;Kräftige Kruste.;Innen saftig.;Aroma entwickelt sich beim Abkühlen.;Mitteleuropa;Historische Verbindung von Brauerei und Bäckerei (Hefe).;Herzhaftes Brot, passt gut zu Grilladen oder Charcuterie. Die Kohlensäure im Bier lockert den Teig zusätzlich.;
active;CH-SPEC-023;CHE-00054-G-001;1;Sauerteigbrot mit UrDinkel;Spezialbrote;1;150g UrDinkelmehl, 100g Wasser, 50g Sauerteig (Anstellgut);Sauerteig (Vortag): Zutaten mischen, 12-16h reifen lassen. Brühstück: 100g Schrot mit 150ml kochendem Wasser übergiessen.;Fermentieren,Brühen;720 Min;CHE-00054-G-001-st1.jpg;Schweizer Brot;CHE-00054-G-001.jpg;Professional food photography, mixing sourdough starter and spelt flour;blurry, text, cartoon;Professional food photography, Sauerteigbrot mit UrDinkel (Spelt Sourdough), artisanal round loaf with ear, banneton rings, floury crust;blurry, text, cartoon;Reiner Sauerteig (ohne Hefe).;Brühstück bindet Wasser im Dinkel.;Für Fortgeschrittene.;Uralt / Revival;Rückbesinnung auf Fermentation ohne Industriehefe.;Bekömmlicher durch langen Abbau von FODMAPs (Fermentation). Charakteristischer, leicht säuerlicher Geschmack.;
active;CH-SPEC-023;CHE-00054-G-001;1;Sauerteigbrot mit UrDinkel;Spezialbrote;2;Reifer Sauerteig, Brühstück, 800g UrDinkelmehl, 5dl Wasser, 25g Salz;Teig: Alle Zutaten mischen. Kneten. 2-3 Stunden ruhen (dabei 2x falten).;Kneten,Gären,Falten;180 Min;CHE-00054-G-001-st2.jpg;Schweizer Brot;CHE-00054-G-001.jpg;Professional food photography, folding spelt dough during bulk fermentation;blurry, text, cartoon;Professional food photography, Sauerteigbrot mit UrDinkel (Spelt Sourdough), artisanal round loaf with ear, banneton rings, floury crust;blurry, text, cartoon;Zeit ist die wichtigste Zutat.;Dehnen und Falten statt wildem Kneten.;Teigtemperatur beachten.;Uralt / Revival;Rückbesinnung auf Fermentation ohne Industriehefe.;Bekömmlicher durch langen Abbau von FODMAPs (Fermentation). Charakteristischer, leicht säuerlicher Geschmack.;
active;CH-SPEC-023;CHE-00054-G-001;1;Sauerteigbrot mit UrDinkel;Spezialbrote;3;Mehl;Formen: Zu runden Laiben wirken. In Gärkorb (Schluss oben). 60 Min garen.;Formen;60 Min;CHE-00054-G-001-st3.jpg;Schweizer Brot;CHE-00054-G-001.jpg;Professional food photography, placing dough into banneton basket;blurry, text, cartoon;Professional food photography, Sauerteigbrot mit UrDinkel (Spelt Sourdough), artisanal round loaf with ear, banneton rings, floury crust;blurry, text, cartoon;Gärkorb gibt Muster.;Sanft formen.;Spannung ist wichtig.;Uralt / Revival;Rückbesinnung auf Fermentation ohne Industriehefe.;Bekömmlicher durch langen Abbau von FODMAPs (Fermentation). Charakteristischer, leicht säuerlicher Geschmack.;
active;CH-SPEC-023;CHE-00054-G-001;1;Sauerteigbrot mit UrDinkel;Spezialbrote;4;Keine;Backen: Auf Blech stürzen, einschneiden. Bei 230 Grad (fallend) 45-55 Min backen.;Backen;55 Min;CHE-00054-G-001-st4.jpg;Schweizer Brot;CHE-00054-G-001.jpg;Professional food photography, baking sourdough bread, oven spring;blurry, text, cartoon;Professional food photography, Sauerteigbrot mit UrDinkel (Spelt Sourdough), artisanal round loaf with ear, banneton rings, floury crust;blurry, text, cartoon;Mutiger Schnitt ('Ear').;Backstein empfohlen.;Meisterklasse.;Uralt / Revival;Rückbesinnung auf Fermentation ohne Industriehefe.;Bekömmlicher durch langen Abbau von FODMAPs (Fermentation). Charakteristischer, leicht säuerlicher Geschmack.;
